{
"$schema": "http://json-schema.org/draft-07/schema#",
"$id": "https://uiao.gov/schemas/dashboard-schema.json",
"title": "UIAO Governance Dashboard Export Schema",
"description": "Canonical schema for governance dashboard data exports. All dashboard exports must validate against this schema.",
"type": "object",
"required": [
"export_timestamp",
"repository",
"health_score",
"metrics",
"open_remediation_count"
],
"properties": {
"export_timestamp": {
"type": "string",
"format": "date-time",
"description": "ISO-8601 timestamp of export generation"
},
"repository": {
"type": "string",
"enum": ["uiao-core", "uiao-docs"],
"description": "Source repository identifier"
},
"health_score": {
"type": "integer",
"minimum": 0,
"maximum": 100,
"description": "Overall canon health score (0-100), weighted average of sub-scores"
},
"metrics": {
"type": "object",
"required": ["validation", "drift", "appendix"],
"properties": {
"validation": {
"type": "object",
"required": ["files_scanned", "compliance_rate", "blocking", "warning", "info"],
"properties": {
"files_scanned": { "type": "integer", "minimum": 0 },
"compliant": { "type": "integer", "minimum": 0 },
"non_compliant": { "type": "integer", "minimum": 0 },
"compliance_rate": { "type": "number", "minimum": 0, "maximum": 100 },
"blocking": { "type": "integer", "minimum": 0 },
"warning": { "type": "integer", "minimum": 0 },
"info": { "type": "integer", "minimum": 0 }
}
},
"drift": {
"type": "object",
"required": ["files_scanned", "drift_count", "drift_free_rate", "blocking", "warning", "info"],
"properties": {
"files_scanned": { "type": "integer", "minimum": 0 },
"drift_count": { "type": "integer", "minimum": 0 },
"drift_free": { "type": "integer", "minimum": 0 },
"drift_free_rate": { "type": "number", "minimum": 0, "maximum": 100 },
"blocking": { "type": "integer", "minimum": 0 },
"warning": { "type": "integer", "minimum": 0 },
"info": { "type": "integer", "minimum": 0 },
"by_category": {
"type": "object",
"additionalProperties": { "type": "integer", "minimum": 0 },
"description": "Drift counts by category (SCHEMA_DRIFT, PROVENANCE_DRIFT, etc.)"
}
}
},
"appendix": {
"type": "object",
"required": ["total_appendices", "with_copy", "missing_copy", "integrity_rate", "copy_compliance"],
"properties": {
"total_appendices": { "type": "integer", "minimum": 0 },
"with_copy": { "type": "integer", "minimum": 0 },
"missing_copy": { "type": "integer", "minimum": 0 },
"valid_frontmatter": { "type": "integer", "minimum": 0 },
"invalid_frontmatter": { "type": "integer", "minimum": 0 },
"integrity_rate": { "type": "number", "minimum": 0, "maximum": 100 },
"copy_compliance": { "type": "number", "minimum": 0, "maximum": 100 }
}
}
}
},
"owner_scores": {
"type": "array",
"items": {
"type": "object",
"required": ["owner", "owned_artifacts", "reliability_score"],
"properties": {
"owner": { "type": "string" },
"owned_artifacts": { "type": "integer", "minimum": 0 },
"blocking_findings": { "type": "integer", "minimum": 0 },
"warning_findings": { "type": "integer", "minimum": 0 },
"reliability_score": { "type": "integer", "minimum": 0, "maximum": 100 },
"sla_compliance_rate": { "type": "number", "minimum": 0, "maximum": 100 }
}
},
"description": "Per-owner governance metrics and reliability scores"
},
"trend_indicators": {
"type": "object",
"properties": {
"period_days": { "type": "integer", "minimum": 0 },
"health_trend": { "type": "number", "description": "Delta health score over period" },
"compliance_trend": { "type": "number", "description": "Delta compliance rate over period" },
"drift_trend": { "type": "integer", "description": "Delta drift count over period" },
"data_points": { "type": "integer", "minimum": 0 }
},
"description": "Rolling trend indicators computed from historical exports"
},
"boundary_exception_count": {
"type": "integer",
"minimum": 0,
"description": "Number of artifacts with boundary-exception: true"
},
"open_remediation_count": {
"type": "integer",
"minimum": 0,
"description": "Total unresolved BLOCKING + WARNING findings across all agents"
},
"sla_heatmap": {
"type": "object",
"additionalProperties": {
"type": "object",
"additionalProperties": {
"type": "string",
"enum": ["green", "yellow", "red", "gray"],
"description": "SLA status: green=on-time, yellow=at-risk, red=overdue, gray=no-data"
}
},
"description": "Owner-by-artifact SLA compliance matrix for heatmap visualization"
}
},
"additionalProperties": false
}