{
  "export_timestamp": "2026-04-14T20:20:31.157974Z",
  "repository": "uiao-core",
  "health_score": 34,
  "metrics": {
    "validation": {
      "files_scanned": 24,
      "compliant": 23,
      "non_compliant": 1,
      "compliance_rate": 95.8,
      "blocking": 7,
      "warning": 0,
      "info": 0
    },
    "drift": {
      "files_scanned": 34,
      "drift_count": 41,
      "drift_free": 1,
      "drift_free_rate": 2.9,
      "blocking": 17,
      "warning": 24,
      "info": 0,
      "by_category": {
        "SCHEMA_DRIFT": 16,
        "VERSION_DRIFT": 2,
        "NAMING_DRIFT": 22,
        "BOUNDARY_DRIFT": 1
      }
    },
    "appendix": {
      "total_appendices": 0,
      "with_copy": 0,
      "missing_copy": 0,
      "valid_frontmatter": 0,
      "invalid_frontmatter": 0,
      "integrity_rate": 0.0,
      "copy_compliance": 0.0
    }
  },
  "owner_scores": [
    {
      "owner": "unassigned",
      "owned_artifacts": 48,
      "blocking_findings": 24,
      "warning_findings": 24,
      "reliability_score": 0
    }
  ],
  "trend_indicators": {
    "period_days": 30,
    "health_trend": 0.0,
    "compliance_trend": 0.0,
    "drift_trend": 0,
    "data_points": 1
  },
  "boundary_exception_count": 0,
  "open_remediation_count": 48
}